Source,Date publised,Region,Link,Story,,,,,,,,,,,,,,,,,,,,,
Mandela Worshington Fellowship,2021,,https://www.mandelawashingtonfellowship.org/program-impact-stories/bringing-maternal-care-to-remote-communities-in-lesotho/,"Mamello Makhele 2021 Fellowship Alumna, Lesotho Bringing Maternal Care to Remote Communities in Lesotho In the landlocked country of Lesotho, many remote communities lack access to healthcare and education services. 2021 Fellowship Alumna Mamello Makhele has committed herself to bridging this divide. Mamello, a registered midwife, has been fighting to bring maternal care, health care, and contraceptives to some of the country’s hardest-to-reach places.  Due to the country’s mountainous terrain, she travels on foot or by donkey to ensure women in these communities receive the care they need. In 2017, a patient suffering complications from an unsafe abortion arrived at the clinic Mamello worked at. Fearing stigma, the young woman’s family didn’t bring her in for care right away, and the woman later died from these complications. Mamello decided then that she wanted to work directly with women across the country to prevent deaths like this one.“I decided to resign from the hospital and work in these hard-to-reach places… I wanted to understand the issues that women faced on an everyday basis,” Mamello said. “For me to be an advocate, it wasn’t enough to read about these issues but to engage with them and learn about their cultures, their traditions, and the way they think.”Across Lesotho, women face barriers that prevent them from seeking maternal care and other medical care. Some travel over two hours to the nearest medical center. Since the COVID-19 pandemic, many of these clinics have closed their doors, shutting off access to essential services for many women. During her visits to local communities, Mamello provides educational sessions on family planning, contraceptives, and maternal care and promotes community awareness on women’s health, gender-based violence, and HIV.  She doesn’t just speak with pregnant women and mothers during her visits, but also engages youth, spouses, and village leaders in these important conversations.“The idea is to educate men to be better advocates…and also to become better partners.” In 2021, Mamello participated in the Mandela Washington Fellowship, studying Leadership in Civic Engagement with Appalachian State University. During the Fellowship, she strengthened her network and honed her public speaking skills. Later that year, Mamello was invited to address members of the Parliament of Lesotho on matters related to abortion laws.She says, “[The Fellowship] also taught us about project management, which was something I was not too familiar with [coming into the program].”Since participating in the Fellowship, she was selected as one of Bill Gates’ Heroes in the Field.“It’s still so serene… For people to celebrate women in the rural areas,” Mamello said.  “It is a dream come true for me.”Looking to the future, Mamello is excited to explore emerging opportunities to utilize technology to reach rural communities, such as utilizing drones to deliver health services. In addition, Mamello is currently serving as a board member for Safe Abortion Action Fund in London. This organization provides funding to grassroots movements across different countries to promote abortion rights.“This means that I will be able to expand my work not only in Lesotho, but also Africa and other continents. It is amazing.” ",,,,,,,,,,,,,,,,,,,,,
Global Sisters Report ,"October 24th, 2022",Berea Plateau,https://www.globalsistersreport.org/news/teen-moms-lesotho-find-shelter-education-local-sisters,"BEREA PLATEAU, Lesotho – Susan tries to smile as she holds her crying baby while seated on a mattress in a small room at Good Shepherd Centre for Teenage Mothers. But it does not entirely erase the pain in her eyes. The 17-year-old dropped out of 10th grade last year after a 30-year-old farm laborer got her pregnant. Her grandmother, with whom she lived, became disappointed after learning she was pregnant and, together with her uncles, chased her out of their home.She sought refuge at the Good Shepherd Centre for Teenage Mothers in Berea Plateau, a small mountainous town about 12 miles from Maseru, the country’s capital. The Good Shepherd Sisters of Quebec of the Lesotho Province run the center, which they founded in 1995.""I had nowhere to go, but when I arrived at the center, the sisters happily welcomed me,"" she said. ""My relatives told me to leave our home because I would embarrass them. The sisters have been of great help to me. My son is being taken care of at the daycare while I am training in dressmaking.""Susan (who asked not to use her real name) said her problems started at age 4, when her mother left her with her grandmother to go to South Africa to seek a job. She never returned. Susan said her mother's absence greatly contributed to her current situation because she had no one to advise and guide her. My uncles used to tell me that my mother abandoned me and went to South Africa for work, and later on, she died of HIV,"" she recalled, tears streaming down her cheeks as she tugged nervously at her blouse. ""I don't think she ever loved me at all.""Susan's story is far from unique: Thousands of girls in this tiny landlocked country in southern Africa are forced to abandon their education as punishment for being pregnant. Because the country's culture discourages premarital sex, a girl who becomes pregnant before marriage is likely to be excluded or banished from her community or family and is referred to as a ""spoiled girl.""
Religious sisters try to help these teen mothers with a safe and supportive place to live while they learn to care for themselves and their children.Good Shepherd Sr. Filipina Hlobotsi said most young mothers at the center come from communities with high poverty, HIV and unemployment. In Lesotho, pregnant girls are left on their own and it seems their life is over, she said.""We started the center because we saw the challenges of teenage mothers,"" said Hlobotsi, the center's outgoing administrator. ""When a girl falls pregnant while still in school, they are sent away, which means their education stops there. Most of them are chased away from their homes, and because of this, they used to come to our convents asking for any help they could get.""We realized that others were undergoing abortions, and some even died during the process."" the cause of teen pregnancy A United Nations Population Fund report indicates that Lesotho is among the leading countries in early and unintended pregnancies, with the adolescent birth rate at 94 per 1,000 girls age 15-19.Analysts have blamed high poverty and unemployment as the leading causes of early pregnancy in Lesotho, a high-altitude kingdom encircled by South Africa. With a 36% poverty rate, the country of 2.2 million is experiencing nearly 25% unemployment, a rate that is projected to remain high due to the effects of the pandemic.The situation has forced thousands of Basotho (the people of Lesotho) to migrate to neighboring South Africa to work in its mines and as domestic workers to provide for their families back home, Hlobotsi said, a trek that puts women at risk of getting trafficked. The children, meanwhile, are left under a relative's care. Nthabeleng Ntoko, 27, whose parents abandoned her for jobs in South Africa, got pregnant at 16.Ntoko, who lives at Good Shepherd with her child, said a man in his early 40s who was working at Letseng Diamond Mine near the border of South Africa would give her a lot of money when he visited.
""I would not have been pregnant if I had parents to guide me,"" she said, adding that her uncles kicked her out of their home after realizing she was pregnant. ""Everyone in the community didn't want to see me. I was forced to drop out of school and seek refuge at the center.""""I didn't know anything about sex and love,"" she added. ""Maybe my mother or father would have advised me to abstain from sex to avoid early pregnancy. I needed that knowledge at the time, but it was not there.""'Here to look for money'In Lesotho, like in many other mining countries, women are not allowed to work in mines or engage in dangerous tasks. Young women — some underage — follow men working in mines along the borders and in South Africa, selling sex to older men to support their families.Global Sisters Report visited Maputsoe, an industrial town in northern Lesotho, to meet men and women engaging in sex for money. Maputsoe is a border town where mineworkers heading to their workplaces from Lesotho stop to have fun and party before crossing the border to South Africa. Dubbed the town that never sleeps, Maputsoe is loaded with tourism activities, including taverns, traditional dance performances and strip clubs. It is just past 7 p.m. on the last Saturday of the month. The streets are still full and buzzing with activity, with no signs of slowing down. Hundreds of near-naked girls and women parade through the town's bars, brothels and streets, advertising themselves to miners approaching them.""I am here to look for money and assist my two children,"" said a 35-year-old woman with braided hair and wearing a skimpy blue dress. ""It's the end (of the) month, and most miners here have received their salaries, so we take advantage of this time to make money.""The woman, who requested anonymity, said she left Maseru two years ago, after her husband went to South Africa to look for a job but never returned, leaving her to care for their children.""It's not easy to raise two children as a single mother,"" she said, adding that she left her children with her mother. ""On a good night, especially at the end of the month, I make up to 500 Lesotho loti (about $30) and send that money back home.""One miner told GSR that because men left their wives at home, they can't resist paying women for sex. ""Every weekend we go to the neighboring villages and towns to look for women so that we enjoy and relax while taking alcohol,"" he said. ""The only way a man finds pleasure is by having a woman."" The 55-year-old noted that most men don't use contraceptives to prevent pregnancy or sexually transmitted diseases, saying they are not easy to find in the region. ""We don't have condoms here, yet we sleep daily with different women and girls,"" he said.The activities make Lesotho one of the highest HIV-infected countries in the world. According to data from UNAIDS, about 1 in 6 people in Lesotho lives with HIV, and more women are affected than men: 27.7% of women live with HIV, compared to 19.7% of men.""Men working in the mines have a lot of money, and they use it to entice young girls they are not interested in marrying because they have their wives,"" Hlobotsi said. ""These men end up leaving these young girls with pregnancies and, in the worst scenarios, HIV. The young girls are forced to drop out of school and are left to take care of their newborns without knowing how to breastfeed, diaper, bathe and other baby care concerns."" Religious sisters have launched initiatives to address this worrying trend.Hlobotsi said the Good Shepherd Centre accommodates 58 teen mothers and their children. The young mothers spend two years learning skills such as hairdressing, sewing, farming and cooking.""We are empowering these young mothers with skills so they can take care of themselves and live decent lives,"" she said, noting that the center also welcomes sexually trafficked and abused women. ""We don't discriminate. We admit all young mothers and those facing other abuses regardless of their faith, level of education or social status.""The sisters have opened the school to the community, allowing parents to drop off their children to study, charging a fee that then helps the sisters manage the school and center.They also have a health facility that serves teen mothers and the surrounding community.""When the girls get here, they have to be tested for HIV, and also they have to start their antenatal care,"" said Good Shepherd Sr. Rosemary Mokebe, who now directs the center. The women learn how to live with the disease, she said, adding that the sisters and staff accompany the women through their delivery and recovery, also looking after the children's well-being.Mokebe plans to expand the center's projects, including sponsoring advanced education for girls who want to become professionals.""We can’t just stop these young girls from achieving their dreams just because they became mothers at a young age,"" she said.To reduce the alarming rate of teenage pregnancies in the country, sisters have started an awareness campaign directed at leaders and elders of communities, as well as parents and children. And every three months, sisters visit men working in the mines to talk to them about the importance of respecting and caring for children. They also visit villages and homes to encourage young girls and boys to abstain from sex, to educate them about the dangers of contracting HIV, and urging parents to embrace their daughters if they get pregnant unintentionally.""We are happy because our message is being received positively, and we believe we will be able to eradicate the vice,"" Hlobotsi said.Still, teen mothers say harsher punishments for sexual offenders and stricter enforcement of the laws would also help stem the tide of teenage pregnancy.""Those older men taking advantage of young girls should be jailed,"" Susan said. ""Most of the people who [got] us pregnant are out there, and they continue to destroy the lives of other young girls.""",,,,,,,,,,,,,,,,,,,,,
Partners in Health,9th April 2010,,https://www.pih.org/article/expanding-the-role-of-traditional-birth-attendants-in-lesotho,"In the small southern African country of Lesotho, about one out of every four adults is HIV positive, and high rates of maternal mortality and morbidity threaten the country’s young mothers. The rough, mountainous terrain and lack of roads exacerbates the situation, preventing many people from easily accessing the medical services eeded to curb the epidemics.To help address these problems, Partners In Health Lesotho (PIHL) is using traditional birth attendants (TBA)—local traditional midwives—to provide women living in rural mountain villages with access to comprehensive services including HIV testing, counselling, and treatment; methods of preventing HIV transmission from mother-to-child; and antenatal (prebirth), delivery, and general post-birth health care; immunizations; as well as general reproductive health services.In May 2009, PIHL, in partnership with the Elton John AIDS Foundation, began to pilot a TBA program in a catchment area that includes 71 villages around PIHL’s health center in Bobete. PIHL hired and trained 100 local women to serve as a link between the clinic and pregnant women—who are literally their neighbors. The TBAs locate and accompany the expectant mothers through their pregnancy and birth to ensure that they have full access to the clinic’s comprehensive services. This includes bringing the women to the clinic to deliver their babies.The TBAs are a part of Lesotho’s traditional midwifery community and PIHL seeks not to replace them, but to further their education and employ them in an expanded role as community health workers in the communities of which they are already a part. And as families traditionally pay TBAs for delivering babies, the PIHL program provides a cash incentive for each woman a TBA accompanies, replacing the income lost when women choose to deliver at the health center. In the first six months of the project, the TBAs completed their training, surveyed their villages, and began to visit pregnant women in their homes. They accompanied 172 women to the clinic for antenatal care, and accompanied 53 women to deliver at the clinic. Clinic deliveries have steadily risen in response to TBA outreach, with at least 24 women giving birth at the health center last month.The advantages of delivering in the Bobete clinic are significant, particularly in preventing the transmission of HIV during childbirth. Delivering with the assistance of a skilled nurse decreases the risks of maternal mortality and morbidity, and infants with health issues can receive immediate medical attention.To enable more women to deliver at the health center, PIHL is renting waiting houses near the clinic that can shelter six women at a time. Rough terrain separating the remote villages from the health center can make the journey virtually impossible for a woman with labor complications, so these houses make it possible for women to make the journey before labor begins.As an extra incentive, PIHL also provides new mothers who fulfil certain criteria (get tested for HIV, attend at least three antenatal visits and deliver their baby at the clinic) with a new baby package, which includes clothing (hat and sweater), pins, and a bathtub. During the programs first six months, PIHL distributed 60 new baby packages.PIHL believes that the accompaniment of the TBAs and the general knowledge and care delivered during the antenatal visits will encourage each woman to deliver her baby at the clinic, and that in doing so families in the Bobete catchment area will see a decrease in HIV mother-to-child transmission rates, as well as maternal and infant mortality and morbidity rates. In the coming year, the PIHL team hopes to expand this program to six more rural health centers.",,,,,,,,,,,,,,,,,,,,,
Relief Web,22nd February 2021,,https://reliefweb.int/report/lesotho/lesotho-better-coordination-could-save-lives-mothers,"THABA-TSEKA, 22 February 2011 (IRIN) - A new joint programme is changing the way the Lesotho government and its development partners deliver aid by getting different government departments, UN agencies and civil society organizations working together to help mothers and their families.Tens of thousands of Basotho already depend on food and agricultural assistance as well as free HIV/AIDS treatment, but the country is no closer to achieving a number of the Millennium Development Goals (MDGs) and progress on some has reversed.Over half the population lives in extreme poverty, an estimated 23 percent of adults are infected with HIV, and for every 100,000 live births, 1,155 women died during or after delivery in 2009; up from 762 in 2004.""Because we're looking at negative trends in these areas, we discussed with the government and I think there was consensus that there was something we weren't doing right,"" said Ahunna Eziakonwa-Onochie, the UN resident coordinator in Lesotho.Starting in June 2010, the joint programme began targeting the four worst performing MDGs - those relating to the eradication of poverty and hunger, to reducing child and maternal mortality and combating HIV - in the four worst performing of Lesotho's 10 districts. The best chance of success, everyone agreed, was to focus interventions on helping mothers. Research has shown that improving their lives has a knock-on effect on other family members.The programme also tries to address the lack of coordination and wasted resources that have plagued aid delivery in the past.Joint assessmentsTake for example Mphu Mopeli*, who is seven months pregnant with her fifth child and living with HIV. Her only income comes from collecting and selling firewood to her neighbours and the small amount her two sons earn working as herd boys. Like many others in her district of Thaba-Tseka, one of Lesotho's most remote and impoverished areas, she might not make it without outside help.Previously, that help would have come, if it came at all, from various sources - the local clinic, the UN World Food Programme (WFP), and extension officers from the Ministry of Agriculture. Mopeli may have been listed as a beneficiary by all of these organizations who would have visited her in separate vehicles, asked her similar questions and never shared her responses with one another.Now various UN agencies and government departments are teaming up to carry out joint assessments and agree on the same group of beneficiaries to receive a comprehensive set of services.The health department is working with partners including the World Health Organization and the UN Children's Fund (UNICEF) to identify pregnant, breast-feeding and HIV-positive mothers and their infants who are in need of food rations from the WFP. The Food and Agricultural Organization (FAO) together with the Ministry of Agriculture makes sure the same women receive seeds, tools and advice on how to grow vegetables and raise chickens that may eventually eradicate the need for food assistance.Hard times delay MDGs Eventually, some of the women will receive training on how to start small businesses that could permanently lift them and their families out of poverty.""The concentration of complementary activities in a given location for a given population is something we've never attempted in a development context,"" said the UN's Eziakonwa-Onochie. ""The goal is to have greater impact because when you programme in bits and pieces, you miss important components and it's not sustainable or complete.""More efficientShe added that the new approach was also more efficient because it allowed for the sharing of skills and resources. In Thaba-Tseka, officials from the ministries of agriculture and health, as well as from the FAO, WFP and NGO Caritas have formed a nutrition team.""We've tried to mix people from different backgrounds,"" explained Washi Mokati, WFP head of office for the district. ""Previously, different organizations were building keyhole gardens [small raised vegetable gardens] in different styles; now we're bringing similar practices together.""Mokati added that the programme is still in its infancy and faces challenges. The new level of coordination requires ""lots of meetings and not everyone attends"".In charge of coordinating those meetings, both at national and district level, is the Food and Nutrition Coordination Office (FNCO), a government entity that previously had an uncertain role as one of many government departments dealing with nutrition.""This programme has reaffirmed our coordinating role,"" said FNCO director Masekonyela Sebotsa. ""Our role is bringing everyone together so we work as a team, because often in government each ministry is doing its own work.""Now you might see [officials from] the Ministry of Health and [the Ministry of] Agriculture travelling in one car; now we work as one.""Although the UN is funding the programme until December 2012 as part of its ""Delivering as One"" initiative aimed at encouraging UN agencies to deliver development assistance in a more coordinated way, Eziakonwa-Onochie said their role had mainly be ""catalytical"".By 2012, the programme should have yielded enough results and best practices for government to decide whether to take over and replicate it in other districts.""It needs to be rooted in a national budget,"" Eziakonwa-Onochie told IRIN, ""otherwise we run the risk of starting something that fizzles out.""",,,,,,,,,,,,,,,,,,,,,
Medicines Sans Frontireers ,3rd November 2015,,https://www.msf.org/lesotho-free-maternal-care-has-impressive-return-investment,"JOHANNESBURG/MASERU – The introduction of free deliveries at a hospital in Lesotho, the country with one of the highest maternal mortality rate in the world, drastically reduced maternal deaths during labour and delivery, making the intervention a cheap and highly effective public health measure, Médecins Sans Frontières (MSF) said on Tuesday. The number of women giving birth in the Roma hospital increased by 45 per cent within a year after MSF offered to cover all their expenses. This shows that fees are a huge barrier in preventing women from seeking medical help for delivery in a country where up to 40 per cent of women give birth at home without the help of a skilled attendant.“Giving life shouldn’t cost a life. But in Lesotho, delivering a baby has either a financial cost for the mother, or a dramatically high human cost for the society. Free maternal health care at both health centre and hospital level is a simple and relatively cheap measure with a huge return on investment in terms of public health”, says Dr Amir Shroufi, MSF deputy medical coordinator for South Africa and Lesotho.According to the World Bank Lesotho has one of the highest maternal mortality rate in the world with estimates ranging anywhere from 600 to 1,200 deaths per 100,000 live births. Maternal death in Lesotho is frequently due to complications around delivery that can be handled at hospital level: 34% due to sepsis, 20% due to post-abortion complication, 14% due to obstructed or prolonged labour and 12% due to eclampsia.Hospital fees for delivery cost as little as $10 per birth for each woman, but this fee can represent up to a month’s salary for rural people in Lesotho. The introduction of free maternal care in the country would only amount to a tiny fraction (less than 1 per cent) of health spend per capita according to MSF calculations.“This strategy shows that removing out of pocket fees for hospital delivery has a very high return on investment. We call on the government of Lesotho to make delivery free also at hospital level for mothers-to-be across the country, and in doing so help ensure that fewer women and infants die around the time of pregnancy”, says Jesper Hildebrandt Brix, MSF’s project coordinator in Lesotho.",,,,,,,,,,,,,,,,,,,,,
