Source,Date publised,Region,Link,Story,,,,,,,,,,,,,,,,,,,,,
Medicines Sans Frontireers ,5th June 2013,Mountain Kingdom,https://www.msf.org/lesotho-maternal-mortality-mountain-kingdom,"Imagine you are nine months pregnant, ready to give birth. You feel your contractions start. You are excited and afraid at the same time but mostly you are in pain and you pray that everything will go well. Now imagine it will take you two, three, four hours or longer, to reach the nearest health facility where you can get an assisted delivery. Imagine mountainous terrain and a journey mostly on foot.What sounds like anyone’s worst nightmare is a reality for many women in Lesotho. Mantebaleng Ntelekoa, a young mother from a rural area in the Lesotho mountains, remembers: “For all of my three deliveries, I walked two hours to the main road and then continued by minibus to the hospital.“I usually started walking when my contractions started and it took a long time, because I had to sit down every time I had a contraction. One of my children was born premature at seven months, so I am glad I made it to the hospital.” But not everyone is as lucky as Mantebaleng. High numbers of people with HIV and poor access to maternity services has lead Lesotho to suffer one of the highest maternal mortality rates in the world at 620 deaths per 100,000 live births – representing about twice the global average.More than 50 percent of those deaths are attributed to HIV-related complications. The government of Lesotho has set a target to reduce maternal deaths to 300 deaths per 100,000 live births by 2015, and is working on an accelerated action plan to reach the far-off Millennium Development Goal for Maternal Health.Yet, at present, the health situation for many expectant mothers in the small southern African mountain kingdom remains uncertain.Mortality rates in very rural and isolated areas are particularly high. Long distances to the nearest health centre, lack of transport, often impassable terrain in the winter season, as well as user fees charged at major hospitals keep many women from accessing antenatal care, lifesaving HIV treatments as well as services for the prevention of mother to child nsmission of HIV.The Médecins Sans Frontières (MSF) team in Lesotho is supporting rural health facilities to ensure that more women from remote areas have access to antenatal services and safe deliveries.A doctor, a midwife and several nurses are supporting health facilities in 10 different locations across the districts of Roma and Semonkong.At St Leonard clinic in Semonkong, there is a small maternity ward and a mothers’ waiting lodge, allowing expecting mothers to come there close to their due date, ensuring they will be able to deliver their babies with the assistance of a trained midwife. New mothers may then stay after giving birth until they are ready to return home with their newborn.“I sleep in the waiting lodge with the mothers when I am in Semonkong, and the atmosphere is quite amazing,” says MSF midwife Marleen Dermaut. “There is a lot of chatting and giggling, the women feel safe and enjoy each others’ company.“After all, they are all in the same position, experiencing the wonder of new life and, away from their duties for a couple of days, are being able to just focusing on themselves and their new babies.”On average, there are six women at the facility at all times. Since last year, the number of assisted deliveries at St Leonard almost tripled from seven to 20 deliveries per month. Likely, this is due to a combination of increased health promotion by health centre staff in the area and MSF’s donation of an ambulance.“The ambulance takes women to the hospital in case of emergencies during labour or after delivery. The hospital is still a two-hour drive away from St Leonard, which can be a long time in an emergency situation. In fact, it already happened that a baby was born in the ambulance,” says Dermaut.Additionally to the specific support of maternity services in Lesotho, a team of MSF health promoters is going out into communities regularly to test people for HIV and tuberculosis (TB) and to improve health education in remote areas.In places with high rates of HIV and TB, this first step is crucial so people understand how to spot the diseases, test for them and be able to start treatment right away if necessary. To reach as many people as possible and to directly involve people living in these areas, MSF trains lay people in communities or “community health workers,” how to test for HIV and when to refer community members to a health facility.“The motivation of many people we work with, be it nurses or community counsellors, and the willingness to make changes definitely makes my work here even more rewarding,” says Dermaut.",,,,,,,,,,,,,,,,,,,,,
Medicines Sans Frontireers ,3rd November 2015,,https://www.msf.org/lesotho-free-maternal-care-has-impressive-return-investment,"JOHANNESBURG/MASERU – The introduction of free deliveries at a hospital in Lesotho, the country with one of the highest maternal mortality rate in the world, drastically reduced maternal deaths during labour and delivery, making the intervention a cheap and highly effective public health measure, Médecins Sans Frontières (MSF) said on Tuesday.The number of women giving birth in the Roma hospital increased by 45 per cent within a year after MSF offered to cover all their expenses. This shows that fees are a huge barrier in preventing women from seeking medical help for delivery in a country where up to 40 per cent of women give birth at home without the help of a skilled attendant.“Giving life shouldn’t cost a life. But in Lesotho, delivering a baby has either a financial cost for the mother, or a dramatically high human cost for the society. Free maternal health care at both health centre and hospital level is a simple and relatively cheap measure with a huge return on investment in terms of public health”, says Dr Amir Shroufi, MSF deputy medical coordinator for South Africa and Lesotho.According to the World Bank Lesotho has one of the highest maternal mortality rate in the world with estimates ranging anywhere from 600 to 1,200 deaths per 100,000 live births. Maternal death in Lesotho is frequently due to complications around delivery that can be handled at hospital level: 34% due to sepsis, 20% due to post-abortion complication, 14% due to obstructed or prolonged labour and 12% due to eclampsia.Hospital fees for delivery cost as little as $10 per birth for each woman, but this fee can represent up to a month’s salary for rural people in Lesotho. The introduction of free maternal care in the country would only amount to a tiny fraction (less than 1 per cent) of health spend per capita according to MSF calculations.“This strategy shows that removing out of pocket fees for hospital delivery has a very high return on investment. We call on the government of Lesotho to make delivery free also at hospital level for mothers-to-be across the country, and in doing so help ensure that fewer women and infants die around the time of pregnancy”, says Jesper Hildebrandt Brix, MSF’s project coordinator in Lesotho.",,,,,,,,,,,,,,,,,,,,,
Government Of UK,2 June 2023,,https://www.gov.uk/guidance/when-someone-dies-in-lesotho,"If you are dealing with the death of a child, multiple deaths, a suspicious death or a case of murder or manslaughter, call +27 12 421 7500.Contacting the travel insurance company If the person who died had insurance, contact their insurance company as soon as possible. Insurance providers may help to cover the cost of repatriation. Repatriation is the process of bringing the body home. Insurance providers may also help with medical, legal, interpretation and translation fees.If the person who died had insurance, the insurance company will appoint a funeral director both locally and in the UK.What to do if the person who died didn’t have insurance If you are not sure whether the person who died had insurance, check with their bank, credit card company or employer.If the person who died did not have insurance, a relative or a formally appointed representative will usually have to appoint a funeral director and be responsible for all costs. The Foreign, Commonwealth & Development Office (FCDO) provides a list of UK-based international funeral directors.The FCDO cannot help with any costs. In some cases, funeral directors and lawyers may provide services on a pro bono basis. Pro bono work is done for free or for a reduced cost, depending on your circumstances. This is decided on a case by case basis.Charities and anisations that offer support Some UK-based charities and organisations may be able to provide help and information to people affected by a death abroad. The FCDO provides a list of UK-based charities and organisations. Mortuary facilities Mortuaries in Lesotho can vary in the facilities that are available. Most major towns and cities have mortuaries with temperature-controlled storage facilities, but these may not be available in rural areas. This may mean the body cannot be preserved in a good condition.Registering the death and getting a death certificate You must register a death in the country where the person died. In Lesotho, deaths are  registered at the National Identity and Civil Registry (NICR) office in the district where the death occurred. You must register the death within one year of the person dying, or you will be charged a penalty. When registering a death you need: Mortuary facilities Mortuaries in Lesotho can vary in the facilities that are available. Most major towns and cities have mortuaries with temperature-controlled storage facilities, but these may not be available in rural areas. This may mean the body cannot be preserved in a good condition. Registering the death and getting a death certificate You must register a death in the country where the person died. In Lesotho, deaths are  registered at the National Identity and Civil Registry (NICR) office in the district where the death occurred. You must register the death within one year of the person dying, or you will be charged a penalty. When registering a death you need: Mortuary facilities Mortuaries in Lesotho can vary in the facilities that are available. Most major towns and cities have mortuaries with temperature-controlled storage facilities, but these may not be available in rural areas. This may mean the body cannot be preserved in a good condition. Registering the death and getting a death certificate You must register a death in the country where the person died. In Lesotho, deaths are  registered at the National Identity and Civil Registry (NICR) office in the district where the death occurred. You must register the death within one year of the person dying, or you will be charged a penalty. When registering a death you need:the death certificate or post-mortem report your photo identification document photo identification of the person who died If you appoint a local funeral director to register the death on your behalf, you will also need to give them a ‘letter of authorisation’ stating that you authorise them to act on your behalf. The funeral director will tell you what the letter needs to include. You, or the funeral director, will also need to complete ‘Form D’ and have an appointment with the registration officer. If the death was unnatural, a post-mortem will be needed before the cause of death can be recorded. The death certificate and a burial permit (if applicable) will be issued in English. You do not need to register the death in the UK. The local death certificate can usually be used in the UK for most purposes, including probate. If you wish, you can register the death with the Overseas Registration Unit (ORU). You can buy a UK-style death certificate, known as a Consular Death Registration certificate. The ORU will send a record to the General RegisterOffice within 12 months. If the person who died suffered from an infectious condition, such as hepatitis or HIV, you must tell the local authorities, so they can take precautions against infection. Dealing with a local post-mortem in Lesotho, post-mortems are performed when the cause of death is unknown, unnatural, sudden or violent. Post-mortems are carried out by state pathologists appointed by the Ministry of Health. Cultural or religious sensitivities may not be taken into account. The FCDO cannot stop or interfere with the process. During a post-mortem, small tissue samples and organs may be removed and retained for testing without the consent of the family. You will not automatically be told if this happens.If a post-mortem was carried out in the country where the person died, you can ask for a copy of the report by contacting one of the following: your local UK coroner if you bring the body back to the UK the British High Commission in Lesotho the Foreign, Commonwealth and Development Office in the UK If you bring the body back to the UK, the UK coroner will automatically assume responsibility and open an inquest. The coroner can investigate the cause of death, and help with translation and interpretation of any medical findings. Bringing the body home Bringing the body home If the person who died had insurance, find out if their insurance provider can help cover the cost of repatriation. Repatriation is the process of bringing the body home. If so, they will make all the necessary arrangements. If the person who died is not covered by insurance, you may need to appoint an international funeral director yourself. There are no airlines currently operating repatriation services from Lesotho. The body must be taken by hearse to the Oliver Tambo International Airport in Johannesburg, South Africa. A commercial airline will then fly the body to the UK. The funeral director will make the necessary arrangements and will request a supporting letter from the next of kin providing consent for cross-border transport to South Africa. To be transported back to the UK, the body must be embalmed within 3 days of death. The body will then be placed in a hermetically sealed zinc coffin and placed in a packing crate. The FCDO provides a list of English-speaking funeral directors in Lesotho. Finding an international funeral director A relative or a formally appointed representative must appoint a UK-based international funeral director for the person who died to be repatriated to the UK. The FCDO provides a list of UK-based international funeral directors. Local funeral directors will work with UK-based international funeral directors to meet all the necessary requirements both locally and in the UK. This includes providing documents such as a local civil registry death certificate, a certificate of embalming and a certificate giving permission to transfer the remains to the UK. Advice and financial assistance for repatriation There are UK organisations and charities that may be able to offer assistance with repatriation. Requesting a post-mortem in the UK If you want to have a post-mortem in the UK after the body has been repatriated, you can request one from a UK coroner. The coroner will then decide if a post-mortem is needed. If you want the person who died to be cremated, you need to apply for a certificate from the coroner (form ‘Cremation 6’).",,,,,,,,,,,,,,,,,,,,,
Health Newborn Network,23rd February 2023,,https://www.healthynewbornnetwork.org/resource/maternal-mortality-lesotho-2000-2020/,"Every day in 2020, approximately 800 women died from preventable causes related to pregnancy and childbirth – meaning that a woman dies around every two minutes.Sustainable Development Goal (SDG) target 3.1 is to reduce maternal mortality to less than 70 maternal deaths per 100 000 live births by 2030. The United Nations Maternal Mortality Estimation Inter-Agency Group (MMEIG) – comprising WHO, the United Nations Children’s Fund (UNICEF), the United Nations Population Fund (UNFPA), the World Bank Group and the United Nations Department of Economic and Social Affairs, Population Division (UNDESA/Population Division) has collaborated with external technical experts on a new round of estimates covering 2000 to 2020. The estimates represent the most up to date, internationally-comparable MMEIG estimates of maternal mortality, using refined input data and methods from previous rounds. This report provides country-specific data for Lesotho. The full report is available here.",,,,,,,,,,,,,,,,,,,,,
Jhpiego,2nd October 2020,,https://www.jhpiego.org/story/preventing-maternal-death-worldwide/,"As a young doctor in Kenya, Harshad Sanghvi saw woman after woman arrive at the district hospital bleeding profusely after giving birth at home. Many lived in far-off villages where the local health clinic was little more than a one-room hut. Families would do what they could to get their wives, sisters, daughters to a district or regional hospital in the hopes that a doctor like Sanghvi would save them from bleeding to death. “Several hours of transport and they were dying on our doorsteps,’’ says Sanghvi. That was 20 years ago. Preventing the needless deaths of new mothers and other women became a primary focus of Sanghvi’s research: “The issue was how to take lifesaving, preventive care to all women rather than wait for women to come to hospitals that were so hard to reach.” Postpartum hemorrhage (PPH) is the leading cause of maternal death worldwide. It occurs when the uterus fails to contract following birth. Pregnant women in Kenya and other developing countries are more vulnerable because they have limited access to skilled health providers and modern health care systems. Sanghvi’s experience as a young doctor in Kenya led him on a path to developing low-cost solutions to health problems of women in some of the most vulnerable corners of the world. For Sanghvi, innovations that save lives of women in developed countries often do not work in low-resource settings because they are too expensive and require facility-based health care systems. He looks for extremely inexpensive interventions that have the chance to reach every woman regardless of where she lives. His work with severe bleeding after birth and misoprostol are one example. “When information first became available about this drug (misoprostol), we immediately saw the potential for tackling the problem of PPH at home birth,” recalls Sanghvi, Vice President and Medical Director of Jhpiego and senior associate at the Bloomberg School of Public Health at John Hopkins University. “The challenge was how to deliver this drug to all women who were pregnant, even those not within the health care system.” The solution for women with little or no access to a trained health care provider took Sanghvi and his research colleagues first to Indonesia and then to rural villages in Faryab, Jawzjan and Kabul provinces in Afghanistan and Banke district in Nepal. The solution lay in training community volunteers to identify all pregnant women, educate these women on the use of misoprostol and then dispense it to them so they could use it immediately following childbirth. Two studies were designed and carried out between June 2005 and August 2007 in the two South Asian countries. Papers co-authored by Sanghvi were released last month in the “International Journal of Gynecology and Obstetrics.” The studies show that a program to educate rural women on the use of misoprostol after delivering a baby at home can significantly reduce postpartum bleeding and ultimately save lives in the developing world. As Sanghvi puts it, “We have found a good way to get the drug to the woman in the antenatal period; she now has the means to protect herself from PPH even if she cannot reach a skilled professional provider.” As a result, both Afghanistan and Nepal are scaling up the intervention nationally, and an introduction is taking place in at least 12 other countries. More than 50 percent of women in developing countries give birth without a skilled birth attendant at their side. Sixty percent to 80 percent of cases of PPH could be prevented if women had access to appropriate care during labor and birth. Active management of third stage of labor – including the use of a uterontic drug – is the most effective way to prevent postpartum hemorrhage. Misoprostol is one of the most effective of these drugs and easier to use because it can be taken as a pill and administered without a skilled birth attendant. A research trial in India published in 2006 had shown convincingly that misoprostol given by a health care provider at home or in a birthing center reduced postpartum hemorrhage. In addition: Sanghvi and his research partners decided to test a strategy for self-administration of the drug, following education of pregnant women and their families. Community health workers living in some of the most remote areas in Afghanistan identified pregnant women and taught them how to take the medication. They met each pregnant woman and her supporting family members in the months prior to birth, providing one-on-one education on labor and delivery and potential complications of birth, including PPH. Women who agreed to accept misoprostol were visited again at eight months and given the misoprostol – but only after they showed that they understood how and when to use the drug, what minor effects to expect and what to do if PPH occurred even after taking the pills. All took misoprostol correctly – immediately after giving birth and before the placenta was delivered. “In the intervention area where community-based distribution of misoprostol was introduced, near-universal uterotonic coverage (92 percent) was achieved compared with 25 percent coverage in control areas,” the study found. The Afghan study concluded that “community-based education and distribution of misoprostol is safe, acceptable, feasible and effective” – a model for use in other countries where women have limited access to skilled birth attendants. The Nepal study found that distribution of misoprostol by community health volunteers associated with the government health system can reach a high proportion of women in a given area. Among the findings: 18,761 pregnant women were dispensed misoprostol by female community health volunteers with no significant adverse events or misuse or incorrect use; The proportion of deliveries protected by a uterotonic rose from 10.4 percent to 72.5 percent; largest gains were among the poor, illiterate and those living in remote areas; Institutional deliveries increased from 9.9 percent to 16.0 percent; and The maternal mortality ratio among 13,969 misoprostol users was 72/100,000, significantly lower than among non-users (304/100,000), as well as the national level of 281/100,000. “To achieve substantial reductions in maternal risk, there is no substitute for wide use of skilled care at delivery, including a full range of clinical support services and ready access to full emergency obstetric care,” the Nepal study’s authors wrote. “But the excellent need not be the enemy of the good. Substantially increasing skilled care at delivery will be difficult in Nepal and elsewhere. “As we continue efforts to improve coverage and quality of delivery services, interim measures can contribute to driving down the burden of maternal deaths,’’ the authors continued. “This study has demonstrated that high coverage with a preventive dose of uterotonic can be achieved with modest means. Much wider use of misoprostol, focusing on those not yet reachable with more definitive care, targets the principal cause of maternal death in low-resource countries and has the potential to significantly reduce post partum hemorrhage deaths due to atony.”",,,,,,,,,,,,,,,,,,,,,
