Source,Date publised,Region,Link,Story,,,,,,,,,,,,,,,,,,,,,
UNFPA,14th September 2022,Motebang Hospital in Leribe district,https://lesotho.unfpa.org/en/news/lesotho-introduces-immediate-postpartum-family-planning-services-hospitals,"After delivering her fifth child at Motebang Hospital in Leribe district, 33-year-old ‘Mathabo*decided together with her husband, to immediately start using contraceptives to avoid an unplanned pregnancy. A day after the birth, whilst still in hospital, she inserted the contraceptive implant – Implanon. She was at the hospital to deliver her baby during introduction of immediate postpartum family planning by the Ministry of Health, under the support of UNFPA, the United Nations Population Fund. The initiative began in Qacha’s Nek and Mokhotlong last year and was implemented in Butha- Buthe and Leribe districts in August this year.  “I will now be able to raise my children well without fear of falling pregnant and will not have to miss work to go for family planning services regularly because the implant will last three years,” she said. Women like ‘Mathabo, who work at the garment factories in Lesotho, often have their pay cut for days on which they miss work, due to the no work, no pay policy at the factories. “I am going to encourage others to use the implant as it is long term” My husband had actually asked me to find a suitable method of family planning and this is it. I am going to encourage others to use the implant as it is long term and to also not listen to those who give them false information.” Thato* also inserted the implanon after giving birth at Motebang hospital. She was happy that since the method is long term (three years), she would save money as she would make fewer visits to the clinic. “I was using another method of family planning but because it had run out of stock I stayed without any contraceptive for six months, that is when I fell pregnant,” she pointed out.   sinkUNFPA is supporting Lesotho in introduction of postpartum family planning - the initiation and use of family planning services immediately after childbirth and within the first 12 months following childbirth to reduce maternal and infant morbidity and mortality by preventing unplanned and unwanted pregnancies and to reduce unmet need for family planning among post-partum women. As the Sexual and Reproductive Health Manager at the Ministry of Health Ms Motsoanku ‘Mefane stated, the intention is to strengthen program implementation of family planning and eventually contribute to FP indicators, create more opportunities for women to initiate family planning methods before they leave the health facility and sharpen service providers’ skills and competences on FP. “Also, we want to offer them the family planning services while they are still at the health facility after child birth because they may face many different challenges that may refrain them from getting back to the facility for family planning after they leave,” she added.  Increasing Contraceptive Use Since the initiative to offer modern contraception services as part of care provided during childbirth is expected to also ncrease contraceptive use and reduce both unintended pregnancies and pregnancies that are too closely spaced, it is considered to be even more advantageous to adolescents and young people. According to a Nurse working at the Adolescent Health Corner at Motebang hospital Ms ‘Makhauta Litaolana, the introduction of postpartum family planning will help in educing unintended pregnancies which sometimes lead to illegal abortions that are also sometimes fatal to young people. Recent data obtained from one hospital covering the first quarter (January – March) of 2019, 2020, 2022 revealed that the percentage of obstetric and gynaecological admissions due to abortion were highest among adolescent girls aged 10 -14 at 5.71 percent.The health workers were also refreshed on modern contraceptives to enhance their knowledge and skills during the orientation on postpartum family planning in Butha-Buthe and Leribe hospitals. One of the key aspects of postpartum family planning is to promote long-term methods and less used methods of FP such as IUCD with a particular interest to increase uptake.",,,,,,,,,,,,,,,,,,,,,
UNFPA,23rd June 2023,Machabeng Hospital,https://lesotho.unfpa.org/en/news/nursing-assistants-laud-training-family-planning,"For ‘Makatleho Takana Leteba, a Nursing Assistant at Machabeng Hospital, the training she had recently on Family Planning has been mostly useful for her working in the highland district of Qacha’snek where young girls aged around 14 /15 often give birth at the hospital. The youngest girl she has seen pregnant was a 12-year-old who was brought for Ante Natal Clinic to the hospital by Community Health Workers in February this year. She had gone with other girls to fetch firewood when they were chased by boys. She was unfortunate to be caught by one of them who raped her and made her pregnant. You can imagine, at that age, coming from the rural areas, she did not know much about what was happening,” she said.
The Lesotho Demographic Health Survey (LDHS) 2014 shows that teenage pregnancy in Lesotho is at 19 % and the most affected places are those in the highlands of the country where access to health services is generally difficult.Leteba believes all sectors of society, young girls, boys, men and women must be educated on family planning to counter early and unintended pregnancies which often result in young girls having to stop pursuing their education and marrying at an early age. Child Marriage in Lesotho is estimated at 24%.a doctor writing on a whiteboardAfter the training, she would share the knowledge she gained with her co-workers and also focus on mother in laws as they are also often the decision makers in households. “We had a woman who was bought to the hospital after her mother in law made her push for three days during delivery. By the time she eventually got to the hospital, the baby was on the perineum, already dead,” she stated adding that the woman had to be transferred to T’sepong hospital in Maseru for treatment of Obstetric Fistula.“I am also going to ensure that we intensify the health education we deliver to young people and advise them on different contraceptive methods they could use,” she concluded. Another Nursing Assistant who received the training Ms Moleboheng Nkongoane said the workshop had been very useful to her as she was trained in a Catholic Nursing School where family planning was not done practically. “I learnt the practical aspect of family planning when I got to work,” she said adding that the workshop helped her advance on the knowledge she had.“For example, I was not aware of the other important aspects regarding insertion of implants such as the weight of the woman. I also knew very little about the guidelines. After the training, I will be confident to advice the women on the most suitable contraception method to use.”She also believes parents should be educated on Family Planning so that they can confidently speak to their children and advise them. In particular, men should be trained on the myths and FMs ‘Makamohelo Pitso also a Nursing Assistant who is from Thaba-Tseka also viewed the workshop as very important.  She would advise women back in her district to use long term family planning methods so that they would not have to visit the health facility frequently and thereby safe on transport money. She also emphasised the importance of long term family planning methods.The training follows an End Line Assessment which showed that Family Planning was not integrated and that there was poor quality of data. As a strategy, training was therefore designed for 24 Nursing Assistants from around the country focusing on Family Planning data and commodities.In Lesotho, UNFPA, the United Nations Population Fund supports the government in efforts to reduce the unmet need for family planning which is currently estimated at 18%.  Access to and use of contraception is an important strategy to reduce maternal mortality in the country.",,,,,,,,,,,,,,,,,,,,,
Jhpiego,,Basotho,https://www.jhpiego.org/countries-we-support/lesotho/,"More than 122,000 Basotho have learned their HIV status through Jhpiego-led initiatives, and over 210,000 men have received voluntary medical male circumcision services, thereby benefiting from this procedure’s protective effect against HIV infection. Jhpiego pioneered the first-ever integrated, comprehensive, nurse-led male clinic, which received over 18,000 patient visits in the first two years. The clinic, which provides client-centered, male-friendly health services and improves male health-seeking behaviors, has been endorsed by the Ministry of Health and is being replicated at 13 primary health care clinics.Jhpiego supported the Lesotho Nursing Council to introduce task shifting for nurse practitioners to establish and implement a sustainable, nurse-led HIV/AIDS response. This includes nurse-initiated and nurse-managed antiretroviral therapy services for people living with HIV, thereby reducing the burden on doctors so they can focus on more advanced care needs.Jhpiego is supporting the Ministry of Health to provide pre-exposure prophylaxis and other combination prevention services to more than 13,000 people at high risk of contracting HIV, primarily adolescent girls and young women.With funding from the U.S. Agency for International Development (USAID), Jhpiego is working in select countries, including Lesotho, to address the COVID-19 pandemic. In line with ministry of health priorities in each country, RISE’s COVID-19 response support may include: assisting in the planning and rollout of national vaccine plans, including ensuring health care workers are prepared to implement and monitor this plan; providing focused and clinically relevant capacity building for clinicians providing COVID-19 case management; strengthening the oxygen ecosystem; and supporting health care workers in oxygen conservation, rationalization and non-invasive respiratory care.RISE is a five-year global project—funded by the U.S. President’s Emergency Plan for AIDS Relief (PEPFAR) and USAID—that works with countries to achieve a shared vision of attaining and maintaining epidemic control, with stronger local partners capable of managing and achieving results through sustainable, self-reliant and resilient health systems. The project is led by Jhpiego with the following partners: ICAP at Columbia University, Management Sciences for Health, Anova, BAO Systems, Johns Hopkins University Center for Public Health and Human Rights, and Mann Global Health. For the COVID-19 ventilator technical assistance effort, RISE is also collaborating with the University of California San Francisco, World Federation of Societies of Anesthesiologists (via the GH STAR project), FHI 360 (via the EpiC Project) and Johns Hopkins University emergency medicine and critical care staff.",,,,,,,,,,,,,,,,,,,,,
Global Sisters Report ,24th October 2022,BEREA PLATEAU,https://www.globalsistersreport.org/news/teen-moms-lesotho-find-shelter-education-local-sisters,"BEREA PLATEAU, Lesotho – Susan tries to smile as she holds her crying baby while seated on a mattress in a small room at Good Shepherd Centre for Teenage Mothers. But it does not entirely erase the pain in her eyes. The 17-year-old dropped out of 10th grade last year after a 30-year-old farm laborer got her pregnant. Her grandmother, with whom she lived, became disappointed after learning she was pregnant and, together with her uncles, chased her out of their home.She sought refuge at the Good Shepherd Centre for Teenage Mothers in Berea Plateau, a small mountainous town about 12 miles from Maseru, the country’s capital. The Good Shepherd Sisters of Quebec of the Lesotho Province run the center, which they founded in 1995. ""I had nowhere to go, but when I arrived at the center, the sisters happily welcomed me,"" she said. ""My relatives told me to leave our home because I would embarrass them. The sisters have been of great help to me. My son is being taken care of at the daycare while I am training in dressmaking."" Susan (who asked not to use her real name) said her problems started at age 4, when her mother left her with her grandmother to go to South Africa to seek a job. She never returned. Susan said her mother's absence greatly contributed to her current situation because she had no one to advise and guide her. ""My uncles used to tell me that my mother abandoned me and went to South Africa for work, and later on, she died of HIV,"" she recalled, tears streaming down her cheeks as she tugged nervously at her blouse. ""I don't think she ever loved me at all."" Susan's story is far from unique: Thousands of girls in this tiny landlocked country in southern Africa are forced to abandon their education as punishment for being pregnant. Because the country's culture discourages premarital sex, a girl who becomes pregnant before marriage is likely to be excluded or banished from her community or family and is referred to as a ""spoiled girl."" Religious sisters try to help these teen mothers with a safe and supportive place to live while they learn to care for themselves and their children. Good Shepherd Sr. Filipina Hlobotsi said most young mothers at the center come from communities with high poverty, HIV and unemployment. In Lesotho, pregnant girls are left on their own and it seems their life is over, she said. ""We started the center because we saw the challenges of teenage mothers,"" said Hlobotsi, the center's outgoing administrator. ""When a girl falls pregnant while still in school, they are sent away, which means their education stops there. Most of them are chased away from their homes, and because of this, they used to come to our convents asking for any help they could get. ""We realized that others were undergoing abortions, and some even died during the process."" The cause of teen pregnancy A United Nations Population Fund report indicates that Lesotho is among the leading countries in early and unintended pregnancies, with the adolescent birth rate at 94 per 1,000 girls age 15-19. Analysts have blamed high poverty and unemployment as the leading causes of early pregnancy in Lesotho, a high-altitude kingdom encircled by South Africa. With a 36% poverty rate, the country of 2.2 million is experiencing nearly 25% unemployment, a rate that is projected to remain high due to the effects of the pandemic. The situation has forced thousands of Basotho (the people of Lesotho) to migrate to neighboring South Africa to work in its mines and as domestic workers to provide for their families back home, Hlobotsi said, a trek that puts women at risk of getting trafficked. The children, meanwhile, are left under a relative's care.",,,,,,,,,,,,,,,,,,,,,
UNFPA,12th March 2020,HA MOEKETSANE,https://www.unfpa.org/news/climate-change-affected-lesotho-self-injected-contraceptives-empower-women-choose-their-own,"HA MOEKETSANE, Lesotho – Regina Mokoena has seen first-hand how drought and climate change are increasing the demand for family planning in her village. Ms. Mokoena is a local health worker in Ha Moeketsane, in Lesotho’s mountainous rural Mokhotlong District. She says drought is disrupting livelihoods in this farming community, making it harder for parents to support large families.“In these difficult times, it is not easy to look for a job or to get employed when you have many children, especially here in the village,” she said. “Besides, educating children is also very demanding.”During last summer’s cropping season, the district of Mokhotlong was one of the hardest hit by severe drought. Large numbers of livestock – a main source of livelihood – were lost. Ms. Mokoena says the economic uncertainty has fuelled demand for contraceptives among the district’s women, including interest in a new form of family planning uniquely well suited to rural areas without easy access to health services: injectable contraceptives that women can administer themselves.Unmet need for family planningMokhotlong has one of Lesotho’s highest rates of unmet need for family planning. This has led to the highest fertility rate in the country, with each woman having an average of 4.4 children. The gap between actual fertility and a woman’s desired fertility is also the largest, according to a recent household survey. In addition, the district’s teen pregnancy rate is the nation’s second highest, with 24 per cent of girls aged 15-19 having begun childbearing.But these are not just issues in Mokhotlong. Across the country, unsafe abortion is a primary reason for the hospitalization of women and girls, a 2019 Annual Joint Review found.UNFPA is working with the government to expand access to family planning to all women who want it. Voluntary family planning reduces unintended pregnancies, adolescent pregnancies, maternal death and recourse to abortion.The introduction of the self-administered injectable contraceptive is helping to advance this effort by increasing the options available to women.UNFPA and the Ministry of Health have been training health workers like Ms. Mokoena to teach women to inject the contraceptive themselves. Ms. Mokoena says she has been speaking to public gatherings about it, and the response has been largely positive. The self-injected contraceptive is relatively new in the mix of family planning options, but it has already proved popular. Last year, UNFPA procured 13 million units of the contraceptive, and demand continues to outstrip availability.Globally, nearly 40,000 midwives and 48,000 community health workers have been trained by UNFPA to provide this form of family planning.Still, for many women, the thought of administering their own injections is daunting – something to be weighed against the product’s advantages.“I like the new contraceptive as it will help me space my children,” said Thato,* who lives in Mokhotlong. “I am currently afraid to inject myself though. But I guess I will have to overcome my fear to avoid regularly walking for close to an hour to get to the clinic.”The self-injected contraceptive can also reduce stigma, said ‘Manthati Sekoati, the nurse-in-charge at Mapholaneng Clinic in Mokhotlong. Young people are often embarrassed to be seen accessing reproductive health care, she noted, and women face social pressures to have large families. If they can administer their own contraceptives at home, they are more likely to be empowered to choose the size and spacing of their families.Still, do have to make at least one visit to the clinic, Ms. Sekoati said. They have to come to learn how to administer the injection themselves.",,,,,,,,,,,,,,,,,,,,,
Women Deliver,26th September 2018,,https://womendeliver.org/how-community-partnerships-prove-essential-in-the-futures-of-young-mothers-in-lesotho/,"The HIV/AIDS pandemic has rendered Lesotho girls vulnerable to teenage pregnancy and early marriages.  Of all pregnancies in Lesotho, 55% are among adolescent girls and young women (20.7% among 15 – 19-year-olds and 34.3% among 20 – 24-year-olds). Of adolescent girls 15 – 19 in Lesotho, 45.9% have had sexual intercourse, of whom one in three has an unmet need of a modern contraceptive method. Butha Buthe and Thaba-Tseka districts report the highest teenage childbearing rates at 25% and 21% respectively and are among the districts with the lowest use of modern contraception. With 25% of people HIV-positive, Lesotho has a significant cohort of youth growing up without parents to teach them basic knowledge about their reproductive health. Early pregnancy among young girls is on the rise and there has been little support, knowledge, or resources to help them live healthy lives with their babies.Five years ago, a Young Mother Support Program was developed for pregnant or lactating new mothers as young as 14 looking for support and information to better care for their children. Local chiefs encouraged pregnant teens and young mothers from their rural villages to participate in weekly community-based support groups to learn about pre- and post-natal care, depression, basic parenting skills, contraceptives, early child development, and prevention of HIV mother-to-child transmission. The sessions also encourage peer support, tools for boosting self-esteem, and activities to strengthen their agency and ability to speak up for themselves amid stigmatization, fears and unhealthy myths.While the girls were becoming more confident and informed, community leaders soon realized a critical gap – the engagement of boys and men. In fact, feedback from one community discussion indicated that many of the participating young girls experienced push back from their boyfriends, husbands, and even family members who felt intimidated by changing power dynamics and the girls’ growing confidence.  In some cases, this led to instances of gender based violence and loss of the agency needed to stand up and speak up for themselves.To address this, project staff quickly determined the need to strengthen community partnerships including with local religious leaders, chiefs, school principals and community councils.  We asked: what is your advice in moving forward and supporting these young mothers? Their advice was unanimous: we had to involve the men – not too much as to overshadow the emphasis on the women but enough so that the men felt included, and were made aware of what actually is discussed during the program so that they didn’t ‘imagine’ the worst. They also suggested that we include the mothers-in-laws, who have substantial social power in families in the Basotho culture. These partnership meetings generated challenging discussions about the rights and needs of girl and women. Events were held where girls shared what they were learning and how they needed the community to support them and their babies. Never before had these girls stood before the community to champion their rights and state their needs. It was life changing – not just for the girls but also for community members and leaders.The program continues holding community meetings and has begun initiating advocacy days at the end of the program to further engage stakeholders at all levels. During these days, there are marches, performances, speeches and rallies which further build confidence and solidarity while also encouraging community and family members to directly and publicly support the young girls. Young Mother Program Officer, Shasha Makhauta, says, “We now have community leaders coming to us to praise these young women and stand up for their rights within their communities. They recommend girls to our program with pride. Partnering with community leaders in such a direct way has really made all the difference.” Change is difficult and as this program demonstrated, community level partnerships may be the key to driving sustainable progress.  Everyone needs to be involved. It does take a village!

",,,,,,,,,,,,,,,,,,,,,
