Source,Date publised,Region,Link,Story,,,,,,,,,,,,,,,,,,,,,
UNFPA Lesotho UN agencies ,24th February 2023,,https://lesotho.unfpa.org/en/news/woman-dies-every-two-minutes-due-pregnancy-or-childbirth-un-agencies-3,"Every two minutes, a woman dies during pregnancy or childbirth, according to the latest estimates released in a report by United Nations agencies today. This report, Trends in maternal mortality, reveals alarming setbacks for women’s health over recent years, as maternal deaths either increased or stagnated in nearly all regions of the world. 
“While pregnancy should be a time of immense hope and a positive experience for all women, it is tragically still a shockingly dangerous experience for millions around the world who lack access to high quality, respectful health care,” said Dr Tedros Adhanom Ghebreyesus, Director-General of the World Health Organization (WHO). “These new statistics reveal the urgent need to ensure every woman and girl has access to critical health services before, during and after childbirth, and that they can fully exercise their reproductive rights.” The report, which tracks maternal deaths nationally, regionally and globally from 2000 to 2020, shows there were an estimated 287 000 maternal deaths worldwide in 2020. This marks only a slight decrease from 309 000 in 2016 when the Sustainable Development Goals (SDGs) came into effect. While the report presents some significant progress in reducing maternal deaths between 2000 and 2015, gains largely stalled, or in some cases even reversed, after 2015. In two of the eight UN regions – Europe and Northern America, and Latin America and the Caribbean – the maternal mortality rate increased from 2016 to 2020, by 17% and 15% respectively. Elsewhere, the rate stagnated. The report notes, however, that progress is possible. For example, two regions – Australia and New Zealand, and Central and Southern Asia – experienced significant declines (by 35% and 16% respectively) in their maternal mortality rates during the same period, as did 31 countries across the world.“For millions of families, the miracle of childbirth is marred by the tragedy of maternal deaths,” said UNICEF Executive Director Catherine Russell. “No mother should have to fear for her life while bringing a baby into the world, especially when the knowledge and tools to treat common complications exist. Equity in healthcare gives every mother, no matter who they are or where they are, a fair chance at a safe delivery and a healthy future with their family.” In total numbers, maternal deaths continue to be largely concentrated in the poorest parts of the world and in countries affected by conflict. In 2020, about 70% of all maternal deaths were in sub-Saharan Africa. In nine countries facing severe humanitarian crises, maternal mortality rates were more than double the world average (551 maternal deaths per 100 000 live births, compared to 223 globally). “This report provides yet another stark reminder of the urgent need to double down on our commitment to women and adolescent health,” said Juan Pablo Uribe, Global Director for Health, Nutrition and Population at the World Bank, and Director of the Global Financing Facility. “With immediate action, more investments in primary health care and stronger, more resilient health systems, we can save lives, improve health and well-being, and advance the rights of and opportunities for women and adolescents.”  Severe bleeding, high blood pressure, pregnancy-related infections, complications from unsafe abortion, and underlying conditions that can be aggravated by pregnancy (such as HIV/AIDS and malaria) are the leading causes of maternal deaths. These are all largely preventable and treatable with access to high-quality and respectful healthcare.  Community-centered primary health care can meet the needs of women, children and adolescents and enable equitable access to critical services such as assisted births and pre- and postnatal care, childhood vaccinations, nutrition and family planning. However, underfunding of primary health care systems, a lack of trained health care workers, and weak supply chains for medical products are threatening progress.  Roughly a third of women do not have even four of a recommended eight antenatal checks or receive essential postnatal care, while some 270 million women lack access to modern family planning methods. Exercising control over their reproductive health – particularly decisions about if and when to have children – is critical to ensure that women can plan and space childbearing and protect their health. Inequities related to income, education, race or ethnicity further increase risks for marginalized pregnant women, who have the least access to essential maternity care but are most likely to experience underlying health problems in pregnancy. ""It is unacceptable that so many women continue to die needlessly in pregnancy and childbirth. Over 280,000 fatalities in a single year is unconscionable,” said UNFPA Executive Director Dr. Natalia Kanem. “We can and must do better by urgently investing in family planning and filling the global shortage of 900,000 midwives so that every woman can get the lifesaving care she needs. We have the tools, knowledge and resources to end preventable maternal deaths; what we need now is the political will.""The COVID-19 pandemic may have further held back progress on maternal health. Noting the current data series ends in 2020, more data will be needed to show the true impacts of the pandemic on maternal deaths. However, COVID-19 infections can increase risks during pregnancy, so countries should take action to ensure pregnant women and those planning pregnancies have access to COVID-19 vaccines and effective antenatal care. ""Reducing maternal mortality remains one of the most pressing global health challenges,” said John Wilmoth, Director of the Population Division of the Department of Economic and Social Affairs. “Ending preventable maternal deaths and providing universal access to quality maternal health care require sustained national and international efforts and unwavering commitments, particularly for the most vulnerable populations.  It is our collective responsibility to ensure that every mother, everywhere, survives childbirth, so that she and her children can thrive."" The report reveals that the world must significantly accelerate progress to meet global targets for reducing maternal deaths, or else risk the lives of over 1 million more women by 2030.",,,,,,,,,,,,,,,,,,,,,
Pedestric Aids Foundation,May 2017,Leribe,https://www.pedaids.org/2017/05/10/a-mosotho-mothers-relief-saving-infant-lives-through-early-diagnosis-and-care/,"Today, Lebele Mathato has brought her daughter, Nyakallo, for her 6-week check-up at the Maputsoe Clinic in Leribe, Lesotho.  Nyakallo is alert and growing well. But as a woman living with HIV, Lebele has a lingering concern. Has she transmitted the incurable virus to her daughter during pregnancy or childbirth?
Lebele well remembers her anxiety of several years back when she brought her infant son, Tuma, to the clinic to determine his HIV status. When he was 6 weeks old, a health worker took blood samples from Tuma’s heel and applied them to a special card. Once the blood spots had dried, the card was shipped to a laboratory in Maseru for analysis to see if he had been infected with HIV. Lebele had to wait more than a month for the results.In the end she was relieved to learn that Tuma was HIV-negative. But the long wait was hard for her—especially because like many Basotho women, she lives in a village far from the town center and must walk for several hours to get to the clinic. The longer an HIV-positive infant goes undiagnosed, the more likely they are to fall ill or die. Without treatment, 3 out of every 10 HIV-positive infants die before their first birthday, most within the first 3 months of life. In contrast, today, Lebele will receive the results of her daughter’s test by the time that she leaves the clinic. In January 2017, through funding from Unitaid, the Elizabeth Glaser Pediatric AIDS Foundation (EGPAF) installed a point-of-care machine in the clinic for diagnosing the HIV status of young infants. Using innovative point-of-care technologies, test results are returned quicker as the sample does not need to travel to the central laboratory anymore; but is instead analyzed in the clinic. This allows HIV-positive infants to be diagnosed and initiated on life-saving antiretroviral treatment (ART) on the same day.",,,,,,,,,,,,,,,,,,,,,
Pedestric Aids Foundation,December 2016,Maputsoe,https://www.pedaids.org/2016/12/13/early-infant-diagnosis-in-lesotho-bringing-the-test-to-the-baby/,"The training room at the Seventh Day Adventist (SDA) Health Centre in the dusty border town of Maputsoe, Lesotho, is filled with women dressed in white. Several of them crowd around a cube-shaped machine, small enough to fit inside a plastic grocery bag, on the tabletop at the front.
A woman pours a few drops of fake blood into a tube inside a cassette-sized canister, then slides the canister into the cube-shaped machine. “Reading cartridge…” reads the screen. A ripple of excitement spreads through the group.
These women aren’t highly trained nurses or lab technicians; they are lay health workers. The machine they are learning to use will test babies for HIV.Any adult who has had a rapid HIV test knows that the process is simple, at least logistically. Hold out a finger, feel the prick, wait nervously, receive results a few minutes later.
The process is more complicated for newborn babies. Because of maternal antibodies in a newborn’s blood, babies need a more sophisticated virologic test to determine their HIV status, and those tests can’t be performed on the spot. Up until recently the best way to test a baby was through a dried blood spot—or DBS—test, which requires collecting a blood sample from the baby, drying the blood on a test slide, and sending the slide away for analysis in an offsite lab.In a country like Lesotho, the complicated logistics of processing DBS tests can mean life or death for an HIV-infected baby. The country has notoriously mountainous terrain, with substantial numbers of people living in hard-to-reach areas. There is only one laboratory in the country equipped to process DBS tests, located in the capital city of Maseru. This set of factors means it can take several weeks, even a couple of months, for DBS results to be returned to the clinic of origin. Once the results are in, it can be difficult to track down the affected mother-and-baby pair to deliver the news.An HIV-infected baby’s first few months are critical, and without immediate treatment the baby has a high probability of death. About 30 percent of HIV-infected babies die before they turn one, and many more become critically ill. The majority die before their fifth birthday.
Babies living with HIV need to be identified and treated as early and quickly as possible – preferably at the point of care (POC) during their first post-natal health visit. The cube-shaped early infant diagnosis (EID) machine at the Maputsoe SDA Health Centre will make this possible.
In partnership with UNITAID, the Elizabeth Glaser Pediatric AIDS Foundation (EGPAF) is dispersing these machines—together with a slightly larger version for bigger health facilities—to a number of pilot sites around Lesotho. The machine tests a baby’s blood for HIV in about 90 minutes as the mother and baby wait—printing the result on a small portable printer. If the baby tests positive, (s)he can be initiated onto treatment right then, before leaving the clinic.This improvement to the EID process is expected to have a huge impact on the number of babies who test for HIV and actually receive their results, as well as the number of HIV-positive babies who are initiated onto treatment before it’s too late.By the end of 2018, Lesotho will have 29 EID testing “hub” sites using the POC machines, with an additional 160 “spoke sites” feeding samples to the hub sites. The main goal of the EGPAF-UNITAID project is to reduce the turnaround time for delivering HIV test results to a baby’s caregiver from the current 30-60 days to zero days at hub sites, and seven days at spoke sites.The project seeks to achieve a 20 percent increase in HIV testing among infants in Lesotho by 2019.The EID POC machines began arriving in Lesotho in late November, and were formally unveiled to the public on World AIDS Day (December 1) by Lesotho’s Queen ‘Masenate Mohato Seeiso. The machines are already in use at a couple of sites.The trainees at Maputsoe SDA hospital used fake blood and blood from an adult’s finger while learning to use the POC EID machines. Soon though, they will be pricking babies’ heels and feeding the few drops of blood into the cube-shaped machine on the table. Just like that, children’s lives will change",,,,,,,,,,,,,,,,,,,,,
UNAIDS,16 July 2009,,https://www.unaids.org/en/resources/presscentre/featurestories/2009/july/20090716lesotho,"“Strengthened services for maternal health, for reproductive health and for paediatric health will mean we can prevent mothers from dying and babies from becoming infected with HIV in Lesotho and around the world,” said Mr Michel Sidibé, UNAIDS Executive Director. Strengthened services for maternal health, for reproductive health and for paediatric health will mean we can prevent mothers from dying and babies from becoming infected with HIV in Lesotho and around the world, Mr Sidibé was speaking during his official visit to Lesotho which ended with a visit to the children’s ward and mother and child health section of the Queen Elizabeth II hospital in Maseru. He was accompanied by the Minister of Health Dr Mphu Ramatlapeng. Mr Sidibé earlier was welcomed into the home of Ms Pitso a HIV-positive mother who thanks to access to services for the prevention of mother-to-child transmission gave birth 11 months ago to her baby boy Emlyn who is free of HIV. Mr Sidibé listened to Ms Pitso’s hopes for a bright future for her son. Mr Sidibé has Lesotho has made progress in coverage of prevention of mother-to-child transmission services for pregnant women, up from 5% in 2006 to 42% in the first quarter 2009. Without any intervention, an HIV positive pregnant woman’s chances of passing HIV to her baby are 30-40%. Infection transmission is the highest during pregnancy and delivery, but also during breastfeeding, especially if breast milk is mixed with other feeding. With the provision of a comprehensive prevention services, the transmission rate can be reduced to less than 2%.“Lesotho is a model in its achievements, particularly in the field of preventing mother to child transmission of HIV,” said Mr Sidibé.At the Queen Elizabeth II hospital, Mr Sidibé also acknowledged the contribution and commitment of health care workers. Addressing staff shortages in health and social sectors has been an aim of the Government of Lesotho who in partnership with the UN have developed an emergency human resources strategic plan, which includes ways of attracting, training and retaining health personnel.His Majesty, King Letsie III hosted a meeting yesterday with the Executive Director. Mr Sidibé also met with and Prime Minister Pakalitha Bethuel Mosisili-Qhobosheaneng, members of Lesotho’s national AIDS Commission, and other senior government officials.During his two day visit he participated in a joint civil society meeting with the Lesotho Network of People Living with HIV and AIDS (LENEPWA), Lesotho Inter-Religious AIDS Consortium (LIRAC) and Lesotho Council of NGOs (LCN). The organizations stressed the need for strengthened institutional capacity and delivery of meaningful and evidence based programmes to achieve a unified response to HIV.Mr Sidibé, addressing the participants who are openly living with HIV, said “It is because of your experience and your life that we have managed to break the conspiracy of silence surrounding HIV and AIDS.” Mr Sidibé had a meeting with UN staff and the UN Country Team followed by lunch catered by Positively Masutsa, a catering service exclusively employing HIV positive people.
An evening event hosted by acting Minister of Foreign Affairs & International Relations, Mr Semano Sekatle included the launch of the first Joint UN programme on AIDS in Lesotho. Launching the joint programme Ms Ahunna Eziakonwa-Onochie, the country’s UN Resident Coordinator said: “Lesotho deserves a unified UN that is not fragmented, that does not duplicate efforts and resources, but stands in a united front against the scourge of HIV.”
Lesotho has the third highest adult HIV prevalence in the world with 23% of those aged 15 to 49 living with HIV. Multiple sexual relationships are a major risk factor in Lesotho’s hyper endemic HIV situation.",,,,,,,,,,,,,,,,,,,,,
